{
  "contractVersion": "1.0",
  "eventId": "evt-event-daily-summary-01JQ8G7N6K1A",
  "eventType": "omc.daily-operations-summary-requested.v1",
  "source": "xomc-prod-01",
  "occurredAt": "2026-08-27T02:16:30Z",
  "traceId": "01JQ8G7N6K1A2B3C4D5E6F7G8H",
  "integrationPack": {
    "key": "com.baicells.xomc",
    "version": "1.0.0",
    "digest": "sha256:aaaaaaaaaaaaaaaaaaaaaaaaaaaaaaaaaaaaaaaaaaaaaaaaaaaaaaaaaaaaaaaa"
  },
  "handbookDigest": "sha256:bbbbbbbbbbbbbbbbbbbbbbbbbbbbbbbbbbbbbbbbbbbbbbbbbbbbbbbbbbbbbbbb",
  "tenantRef": "operator-demo",
  "resources": [
    {
      "type": "ne_group",
      "id": "ng-1",
      "role": "scope"
    }
  ],
  "data": {
    "windowStart": "2026-08-26T00:00:00Z",
    "windowEnd": "2026-08-27T00:00:00Z"
  }
}
